{
  "contract_version": "0.1", "manual_id": "example-controller-x1-v3-en", "family_id": "example-controller-x1", "title": "Example Controller X1 User Manual V3", "language": "en", "version": "3",
  "source": {"source_id": "example-x1-en-v3", "type": "pdf", "title": "Example Controller X1 User Manual V3", "language": "en", "version": "3", "published_at": "2026-01-15", "file_name": "example-x1-v3.pdf", "checksum": {"algorithm": "sha256", "value": "aaaaaaaaaaaaaaaaaaaaaaaaaaaaaaaaaaaaaaaaaaaaaaaaaaaaaaaaaaaaaaaa"}},
  "sections": [{"section_id": "failsafe", "title": "Fail Safe", "source": {"source_id": "example-x1-en-v3", "pages": [10, 11]}, "web": {"path": "/manuals/example-x1/v3/failsafe/"}, "tables": [{"id": "failsafe-modes", "source_page": 10}], "figures": [{"id": "failsafe-screen", "source_page": 11}]}],
  "publication": {"status": "validated", "generated_at": "2026-03-01T12:00:00Z", "generator": {"name": "example-builder", "version": "0.1.0"}, "cache": {"mode": "static"}},
  "provenance": {"source_ids": ["example-x1-en-v3"], "evidence": [{"evidence_id": "ev-failsafe-pages", "claim_id": "claim-failsafe-setting", "manual_id": "example-controller-x1-v3-en", "section_id": "failsafe", "source_id": "example-x1-en-v3", "source_pages": [10, 11]}]}
}
