{
  "contract_version": "0.1", "manual_id": "example-controller-x1-v1-ja", "family_id": "example-controller-x1", "title": "Example Controller X1 マニュアル V1", "language": "ja-JP", "version": "1",
  "source": {"source_id": "example-x1-ja-v1", "type": "pdf", "title": "Example Controller X1 V1", "language": "ja-JP", "version": "1", "published_at": "2024-01-15", "file_name": "example-x1-v1.pdf", "checksum": {"algorithm": "sha256", "value": "1111111111111111111111111111111111111111111111111111111111111111"}},
  "sections": [{"section_id": "setup", "title": "セットアップ", "source": {"source_id": "example-x1-ja-v1", "pages": [5]}, "web": {"path": "/manuals/example-x1/v1/setup/"}}],
  "publication": {"status": "archived", "canonical_url": "https://example.invalid/manuals/example-x1/v1/"}, "provenance": {"source_ids": ["example-x1-ja-v1"], "evidence": []}
}
